{
  "$schema": "./layer-contract.schema.json",
  "schema_version": "ai-bim-layer-contract/v1",
  "purpose": "Executable language-level layer boundaries. It declares, per scanned service, which module belongs to which layer and which layer may depend on which other layer. The observed module graph produced by the Phase 2 static scan is judged against this contract by scripts/lib/layered_architecture.py.",
  "enforcement_note": "Module-level cycles remain owned by ARCH-GRAPH-001 (architecture/observed-baseline.json). This contract judges direction across layers only. Same-layer edges are always permitted here and are not evidence that the design is healthy.",
  "tooling_deviation": {
    "named_tools": [
      "dependency-cruiser",
      "import-linter"
    ],
    "adopted": false,
    "reason": "The canonical root-contract CI job installs only pytest and jsonschema on windows-latest, apps/kit-manager-web has no package-lock.json to pin an npm dev tool against, and neither tool guarantees the byte-identical Windows/Linux report output this repository asserts for architecture artifacts. Layer boundaries are enforced instead by a standard-library checker that reuses the Phase 2 module-graph extractors and the same ratchet discipline, matching the declared Phase 2 GitNexus deviation. Adopting the named tools later remains possible and would be additive; this disclosure must be superseded rather than deleted.",
    "scope_limits": [
      "Only statically resolvable intra-service module imports are judged. Dynamic imports, runtime-resolved module names, and cross-service calls are out of scope.",
      "Files excluded by architecture/observed-graph.config.json (tests, fixtures, harness, generated, dist) are not scanned and therefore not layered."
    ]
  },
  "layer_sets": [
    {
      "language": "typescript",
      "layers": [
        "ui",
        "application",
        "client",
        "domain"
      ],
      "description": "ui renders and handles user interaction; application holds orchestration, routing and state machines; client owns outbound transport adapters; domain holds pure types, helpers and shared primitives.",
      "allowed": [
        {
          "from": "ui",
          "to": [
            "application",
            "client",
            "domain"
          ]
        },
        {
          "from": "application",
          "to": [
            "client",
            "domain"
          ]
        },
        {
          "from": "client",
          "to": [
            "domain"
          ]
        },
        {
          "from": "domain",
          "to": []
        }
      ]
    },
    {
      "language": "python",
      "layers": [
        "api",
        "application",
        "domain",
        "infrastructure"
      ],
      "description": "api is the inbound HTTP or host entry-point surface; application holds use-case orchestration and package facades; domain holds pure models and rules; infrastructure holds outbound adapters, stores and process-level side effects.",
      "allowed": [
        {
          "from": "api",
          "to": [
            "application",
            "domain",
            "infrastructure"
          ]
        },
        {
          "from": "application",
          "to": [
            "domain",
            "infrastructure"
          ]
        },
        {
          "from": "infrastructure",
          "to": [
            "domain"
          ]
        },
        {
          "from": "domain",
          "to": []
        }
      ]
    }
  ],
  "excluded_services": [],
  "services": [
    {
      "id": "bim-review-coordinator",
      "language": "typescript",
      "note": "Headless Node service. It has no ui layer; an empty layer is legal and is not treated as a missing declaration.",
      "layers": [
        "application",
        "client",
        "domain"
      ],
      "rules": [
        {
          "match": "prefix",
          "value": "services/",
          "layer": "client"
        },
        {
          "match": "exact",
          "value": "types.ts",
          "layer": "domain"
        },
        {
          "match": "exact",
          "value": "config.ts",
          "layer": "domain"
        },
        {
          "match": "prefix",
          "value": "lib/",
          "layer": "domain"
        },
        {
          "match": "prefix",
          "value": "utils/",
          "layer": "domain"
        },
        {
          "match": "exact",
          "value": "index.ts",
          "layer": "application"
        },
        {
          "match": "exact",
          "value": "app.ts",
          "layer": "application"
        },
        {
          "match": "exact",
          "value": "shutdown.ts",
          "layer": "application"
        },
        {
          "match": "exact",
          "value": "runtimeStatus.ts",
          "layer": "application"
        },
        {
          "match": "exact",
          "value": "streamConfig.ts",
          "layer": "application"
        },
        {
          "match": "prefix",
          "value": "routes/",
          "layer": "application"
        },
        {
          "match": "prefix",
          "value": "socket/",
          "layer": "application"
        },
        {
          "match": "prefix",
          "value": "tools/",
          "layer": "application"
        }
      ]
    },
    {
      "id": "bim-streaming-server",
      "language": "python",
      "note": "Omniverse Kit extensions. The package __init__ modules are Kit entry-point facades (from .extension import *, from .setup import *) and are therefore api, not application.",
      "layers": [
        "api",
        "application",
        "domain",
        "infrastructure"
      ],
      "rules": [
        {
          "match": "exact",
          "value": "ezplus.bim_review_stream.messaging",
          "layer": "api"
        },
        {
          "match": "exact",
          "value": "ezplus.bim_review_stream.messaging.extension",
          "layer": "api"
        },
        {
          "match": "exact",
          "value": "ezplus.bim_review_stream.setup",
          "layer": "api"
        },
        {
          "match": "exact",
          "value": "ezplus.bim_review_stream.setup.setup",
          "layer": "api"
        },
        {
          "match": "exact",
          "value": "ezplus.bim_review_stream.messaging.conversion_authority",
          "layer": "application"
        },
        {
          "match": "exact",
          "value": "ezplus.bim_review_stream.messaging.runtime_authority",
          "layer": "application"
        },
        {
          "match": "exact",
          "value": "ezplus.bim_review_stream.messaging.host_native_conversion_service",
          "layer": "application"
        },
        {
          "match": "exact",
          "value": "ezplus.bim_review_stream.messaging.stage_management",
          "layer": "application"
        },
        {
          "match": "exact",
          "value": "ezplus.bim_review_stream.messaging.stage_loading",
          "layer": "application"
        },
        {
          "match": "exact",
          "value": "ezplus.bim_review_stream.messaging.ifc_openusd_identity_author",
          "layer": "domain"
        },
        {
          "match": "exact",
          "value": "ezplus.bim_review_stream.messaging.client_send_bridge",
          "layer": "infrastructure"
        },
        {
          "match": "exact",
          "value": "ezplus.bim_review_stream.messaging.ifc2usdc_powershell_adapter",
          "layer": "infrastructure"
        },
        {
          "match": "exact",
          "value": "ezplus.bim_review_stream.messaging.kit_struct_log",
          "layer": "infrastructure"
        },
        {
          "match": "exact",
          "value": "ezplus.bim_review_stream.messaging.struct_log",
          "layer": "infrastructure"
        }
      ]
    },
    {
      "id": "governance-service",
      "language": "python",
      "note": "app and the *.api routers are the inbound HTTP surface. Package __init__ modules re-export the package use-case surface and are therefore application facades, not api.",
      "layers": [
        "api",
        "application",
        "domain",
        "infrastructure"
      ],
      "rules": [
        {
          "match": "exact",
          "value": "app",
          "layer": "api"
        },
        {
          "match": "exact",
          "value": "bcf.api",
          "layer": "api"
        },
        {
          "match": "exact",
          "value": "diff_engine.api",
          "layer": "api"
        },
        {
          "match": "exact",
          "value": "federation.api",
          "layer": "api"
        },
        {
          "match": "exact",
          "value": "file_library.api",
          "layer": "api"
        },
        {
          "match": "exact",
          "value": "issues.api",
          "layer": "api"
        },
        {
          "match": "exact",
          "value": "issues.a4_api",
          "layer": "api"
        },
        {
          "match": "exact",
          "value": "search.api",
          "layer": "api"
        },
        {
          "match": "exact",
          "value": "bcf",
          "layer": "application"
        },
        {
          "match": "exact",
          "value": "diff_engine",
          "layer": "application"
        },
        {
          "match": "exact",
          "value": "federation",
          "layer": "application"
        },
        {
          "match": "exact",
          "value": "file_library",
          "layer": "application"
        },
        {
          "match": "exact",
          "value": "issues",
          "layer": "application"
        },
        {
          "match": "exact",
          "value": "rule_engine",
          "layer": "application"
        },
        {
          "match": "exact",
          "value": "search",
          "layer": "application"
        },
        {
          "match": "exact",
          "value": "diff_engine.engine",